linear-algebra/labels-systems.json

[
  {
    "label": "sect--systems",
    "anchor": "sect-systems",
    "number": "2",
    "destination": "chapter.2",
    "type_code": "chapter",
    "type_name": "Chapter"
  },
  {
    "label": "def:systems-definition-001",
    "anchor": "def-systems-definition-001",
    "number": "2.1",
    "destination": "Defi.2.1",
    "type_code": "Defi",
    "type_name": "Definition"
  },
  {
    "label": "ex:system-2-no",
    "anchor": "ex-system-2-no",
    "number": "2.10",
    "destination": "Bsp.2.10",
    "type_code": "Bsp",
    "type_name": "Example"
  },
  {
    "label": "ex:system-2-infinite",
    "anchor": "ex-system-2-infinite",
    "number": "2.11",
    "destination": "Bsp.2.11",
    "type_code": "Bsp",
    "type_name": "Example"
  },
  {
    "label": "sum:intersection-lines",
    "anchor": "sum-intersection-lines",
    "number": "2.12",
    "destination": "Summ.2.12",
    "type_code": "Summ",
    "type_name": "Summary"
  },
  {
    "label": "def:homogeneous-linear-system",
    "anchor": "def-homogeneous-linear-system",
    "number": "2.13",
    "destination": "Defi.2.13",
    "type_code": "Defi",
    "type_name": "Definition"
  },
  {
    "label": "rem:trivial-solution",
    "anchor": "rem-trivial-solution",
    "number": "2.14",
    "destination": "Bem.2.14",
    "type_code": "Bem",
    "type_name": "Remark"
  },
  {
    "label": "def:systems-definition-004",
    "anchor": "def-systems-definition-004",
    "number": "2.15",
    "destination": "Defi.2.15",
    "type_code": "Defi",
    "type_name": "Definition"
  },
  {
    "label": "ex:systems-example-005",
    "anchor": "ex-systems-example-005",
    "number": "2.16",
    "destination": "Bsp.2.16",
    "type_code": "Bsp",
    "type_name": "Example"
  },
  {
    "label": "def:elementary-operations-system",
    "anchor": "def-elementary-operations-system",
    "number": "2.17",
    "destination": "Defi.2.17",
    "type_code": "Defi",
    "type_name": "Definition"
  },
  {
    "label": "thm:elementary-equivalent",
    "anchor": "thm-elementary-equivalent",
    "number": "2.18",
    "destination": "Theo.2.18",
    "type_code": "Theo",
    "type_name": "Theorem"
  },
  {
    "label": "ex:example-elementary-operations",
    "anchor": "ex-example-elementary-operations",
    "number": "2.19",
    "destination": "Bsp.2.19",
    "type_code": "Bsp",
    "type_name": "Example"
  },
  {
    "label": "ex:systems-example-001",
    "anchor": "ex-systems-example-001",
    "number": "2.2",
    "destination": "Bsp.2.2",
    "type_code": "Bsp",
    "type_name": "Example"
  },
  {
    "label": "def:systems-definition-006",
    "anchor": "def-systems-definition-006",
    "number": "2.20",
    "destination": "Defi.2.20",
    "type_code": "Defi",
    "type_name": "Definition"
  },
  {
    "label": "ex:systems-example-007",
    "anchor": "ex-systems-example-007",
    "number": "2.21",
    "destination": "Bsp.2.21",
    "type_code": "Bsp",
    "type_name": "Example"
  },
  {
    "label": "not:matrix-notation",
    "anchor": "not-matrix-notation",
    "number": "2.22",
    "destination": "Nota.2.22",
    "type_code": "Nota",
    "type_name": "Notation"
  },
  {
    "label": "def:matrix-to-system",
    "anchor": "def-matrix-to-system",
    "number": "2.23",
    "destination": "Defi.2.23",
    "type_code": "Defi",
    "type_name": "Definition"
  },
  {
    "label": "eqn--linear.system.large",
    "anchor": "eqn-linear-system-large",
    "number": "2.24",
    "destination": "equation.2.24",
    "type_code": "equation",
    "type_name": "Equation"
  },
  {
    "label": "eqn--matrix.large",
    "anchor": "eqn-matrix-large",
    "number": "2.25",
    "destination": "equation.2.25",
    "type_code": "equation",
    "type_name": "Equation"
  },
  {
    "label": "ex:systems-example-008",
    "anchor": "ex-systems-example-008",
    "number": "2.26",
    "destination": "Bsp.2.26",
    "type_code": "Bsp",
    "type_name": "Example"
  },
  {
    "label": "def:row-echelon-form",
    "anchor": "def-row-echelon-form",
    "number": "2.27",
    "destination": "Defi.2.27",
    "type_code": "Defi",
    "type_name": "Definition"
  },
  {
    "label": "def:elementary-row-operations",
    "anchor": "def-elementary-row-operations",
    "number": "2.28",
    "destination": "Defi.2.28",
    "type_code": "Defi",
    "type_name": "Definition"
  },
  {
    "label": "met:gaussian-algorithm",
    "anchor": "met-gaussian-algorithm",
    "number": "2.29",
    "destination": "Meth.2.29",
    "type_code": "Meth",
    "type_name": "Method"
  },
  {
    "label": "eqn--4x2y=3",
    "anchor": "eqn-4x2y-3",
    "number": "2.3",
    "destination": "equation.2.3",
    "type_code": "equation",
    "type_name": "Equation"
  },
  {
    "label": "ex:43-matrix",
    "anchor": "ex-43-matrix",
    "number": "2.30",
    "destination": "Bsp.2.30",
    "type_code": "Bsp",
    "type_name": "Example"
  },
  {
    "label": "met:gaussian-elimination-solve",
    "anchor": "met-gaussian-elimination-solve",
    "number": "2.31",
    "destination": "Meth.2.31",
    "type_code": "Meth",
    "type_name": "Method"
  },
  {
    "label": "ex:systems-example-010",
    "anchor": "ex-systems-example-010",
    "number": "2.32",
    "destination": "Bsp.2.32",
    "type_code": "Bsp",
    "type_name": "Example"
  },
  {
    "label": "eqn--4x2y=3.sol",
    "anchor": "eqn-4x2y-3-sol",
    "number": "2.4",
    "destination": "equation.2.4",
    "type_code": "equation",
    "type_name": "Equation"
  },
  {
    "label": "rem:field",
    "anchor": "rem-field",
    "number": "2.5",
    "destination": "Bem.2.5",
    "type_code": "Bem",
    "type_name": "Remark"
  },
  {
    "label": "rem:systems-remark-002",
    "anchor": "rem-systems-remark-002",
    "number": "2.6",
    "destination": "Bem.2.6",
    "type_code": "Bem",
    "type_name": "Remark"
  },
  {
    "label": "def:systems-definition-002",
    "anchor": "def-systems-definition-002",
    "number": "2.7",
    "destination": "Defi.2.7",
    "type_code": "Defi",
    "type_name": "Definition"
  },
  {
    "label": "ex:system-2-unique",
    "anchor": "ex-system-2-unique",
    "number": "2.8",
    "destination": "Bsp.2.8",
    "type_code": "Bsp",
    "type_name": "Example"
  },
  {
    "label": "system.2.unique.eqn",
    "anchor": "system-2-unique-eqn",
    "number": "2.9",
    "destination": "equation.2.9",
    "type_code": "equation",
    "type_name": "Equation"
  },
  {
    "label": "ueb:systems-1-a",
    "anchor": "ueb-systems-1-a",
    "number": "2.{10}",
    "destination": "Ueba.2.10",
    "type_code": "Ueba",
    "type_name": "Exercise"
  },
  {
    "label": "ueb:systems-1-b",
    "anchor": "ueb-systems-1-b",
    "number": "2.{12}",
    "destination": "Ueba.2.12",
    "type_code": "Ueba",
    "type_name": "Exercise"
  },
  {
    "label": "ueb:systems-1-c",
    "anchor": "ueb-systems-1-c",
    "number": "2.{14}",
    "destination": "Ueba.2.14",
    "type_code": "Ueba",
    "type_name": "Exercise"
  },
  {
    "label": "ueb:systems-1-d",
    "anchor": "ueb-systems-1-d",
    "number": "2.{17}",
    "destination": "Ueba.2.17",
    "type_code": "Ueba",
    "type_name": "Exercise"
  },
  {
    "label": "ueb:systems-1-e",
    "anchor": "ueb-systems-1-e",
    "number": "2.{19}",
    "destination": "Ueba.2.19",
    "type_code": "Ueba",
    "type_name": "Exercise"
  },
  {
    "label": "ueb:systems-1-f",
    "anchor": "ueb-systems-1-f",
    "number": "2.{20}",
    "destination": "Ueba.2.20",
    "type_code": "Ueba",
    "type_name": "Exercise"
  },
  {
    "label": "ex:maps-exercise-008",
    "anchor": "ex-maps-exercise-008",
    "number": "2.{25}",
    "destination": "Ueba.2.25",
    "type_code": "Ueba",
    "type_name": "Exercise"
  },
  {
    "label": "ueb:equation-no-solutions",
    "anchor": "ueb-equation-no-solutions",
    "number": "2.{6}",
    "destination": "Ueba.2.6",
    "type_code": "Ueba",
    "type_name": "Exercise"
  },
  {
    "label": "item--change",
    "anchor": "item-change",
    "number": "{{(1)}}",
    "destination": "Item.3",
    "type_code": "enumi",
    "type_name": "enumi"
  },
  {
    "label": "item--multiply",
    "anchor": "item-multiply",
    "number": "{{(2)}}",
    "destination": "Item.4",
    "type_code": "enumi",
    "type_name": "enumi"
  },
  {
    "label": "item--add",
    "anchor": "item-add",
    "number": "{{(3)}}",
    "destination": "Item.5",
    "type_code": "enumi",
    "type_name": "enumi"
  }
]

lectures/linear-algebra/exercises-systems.md

<span id="ex-systems-gauss-4vars" label="ex:systems-gauss-4vars"></span> (See <a href="../solutions-systems-of-linear-equations/#sol-ex-systems-gauss-4vars" data-reference-type="ref+Label" data-reference="sol--ex:systems-gauss-4vars">Solution 2.3</a>.) Consider the system
<div class="arithmatex" markdown="1">
\[
\begin{align*}
2x_1 - x_2 + x_3 + x_4 & = 1 \\
5x_2 - 3 x_3 - 5 x_4 & = -3 \\
3x_1 - 4 x_2 +3x_3 + 4x_4 &=  3.
\end{align*}
\]
</div>
What is the matrix associated to that system? Using <a href="../systems-gaussian-elimination/#met-gaussian-elimination-solve" data-reference-type="ref+Label" data-reference="met:gaussian-elimination-solve">Method 2.31</a>, find all solutions of that system.

Is the matrix in row-echelon form? Is it in reduced row-echelon form? If not, use the Gaussian algorithm (<a href="../systems-gaussian-elimination/#met-gaussian-algorithm" data-reference-type="ref+Label" data-reference="met:gaussian-algorithm">Method 2.29</a>) in order to transform it into reduced row-echelon form. Name the columns which contain a leading 1 (Hint: there are 4 of them). Which variables are free, which variables are not free? Use <a href="../systems-gaussian-elimination/#met-gaussian-elimination-solve" data-reference-type="ref+Label" data-reference="met:gaussian-elimination-solve">Method 2.31</a> and solve the linear system associated to that augmented matrix.

<span id="ex-systems-two-systems" label="ex:systems-two-systems"></span> (See <a href="../solutions-systems-of-linear-equations/#sol-ex-systems-two-systems" data-reference-type="ref+Label" data-reference="sol--ex:systems-two-systems">Solution 2.5</a>.) Using <a href="../systems-gaussian-elimination/#met-gaussian-elimination-solve" data-reference-type="ref+Label" data-reference="met:gaussian-elimination-solve">Method 2.31</a>, find all solutions of the following systems
<div class="arithmatex" markdown="1">
\[
\begin{align*}
x + y - z & = 1 \\
3x-y+2z & = 5 \\
4x + z & = 6.
\end{align*}
\]
</div>
and
<div class="arithmatex" markdown="1">
\[
\begin{align*}
x+y-z & = 1 \\
3x-y+2z & = 0 \\
x + y - 2 z & = 2.
\end{align*}
\]
</div>

<span id="ex-systems-rref-from-exa" label="ex:systems-rref-from-exa"></span> (See <a href="../solutions-systems-of-linear-equations/#sol-ex-systems-rref-from-exa" data-reference-type="ref+Label" data-reference="sol--ex:systems-rref-from-exa">Solution 2.7</a>.) Compute the reduced row-echelon form of the matrices associated to the linear systems in <a href="../systems-linear-systems/#ex-system-2-unique" data-reference-type="ref+Label" data-reference="ex:system-2-unique">Example 2.8</a>, <a href="../systems-linear-systems/#ex-system-2-no" data-reference-type="ref+Label" data-reference="ex:system-2-no">Example 2.10</a> and <a href="../systems-linear-systems/#ex-system-2-infinite" data-reference-type="ref+Label" data-reference="ex:system-2-infinite">Example 2.11</a>.

<span id="ex-systems-1-a" label="ex:systems-1-a"></span> (See <a href="../solutions-systems-of-linear-equations/#sol-ex-systems-1-a" data-reference-type="ref+Label" data-reference="sol--ex:systems-1-a">Solution 2.10</a>.) Find the solutions of the system
<div class="arithmatex" markdown="1">
\[
\begin{align*}
x_1 + 2x_2 - x_3 & = 0 \\
-2x_1 - 3 x_2 + x_3 & = 1 \\
x_2 - x_3 & = 1.
\end{align*}
\]
</div>

<span id="ex-systems-unique-4x5" label="ex:systems-unique-4x5"></span> (See <a href="../solutions-systems-of-linear-equations/#sol-ex-systems-unique-4x5" data-reference-type="ref+Label" data-reference="sol--ex:systems-unique-4x5">Solution 2.11</a>.) The linear system in the variables $x_1, x_2, x_3, x_4$ associated to the matrix
<div class="arithmatex" markdown="1">
\[
\left ( \begin{array}{cccc|c} 2 & -1 & 1 & -1 & 1 \\ 0 & 1 & -3 & 1 & 3 \\ 2 & 1 & -4 & 1 & 6 \\ 2 & 0 & -2 & 1 & 2 \\ \end{array} \right )
\]
</div>
has only one solution. Find it!

<span id="ex-systems-1-b" label="ex:systems-1-b"></span> (See <a href="../solutions-systems-of-linear-equations/#sol-ex-systems-1-b" data-reference-type="ref+Label" data-reference="sol--ex:systems-1-b">Solution 2.12</a>.) Find the solutions of the following linear system in the variables $x_1, \dots, x_4$:
<div class="arithmatex" markdown="1">
\[
\begin{align*}
x_1 - x_2 + x_3 & = -2 \\
x_3 - x_4 & = 1 \\
x_1 - x_2 + x_4 & = -3 \\
x_1 - x_2 + 3 x_3 - 2 x_4 & = 0.
\end{align*}
\]
</div>

<span id="ex-systems-param-h" label="ex:systems-param-h"></span> (See <a href="../solutions-systems-of-linear-equations/#sol-ex-systems-param-h" data-reference-type="ref+Label" data-reference="sol--ex:systems-param-h">Solution 2.13</a>.) Solve the following linear system, where $h$ is a parameter, and $x, y$ are the unknowns:
<div class="arithmatex" markdown="1">
\[
\begin{align*}
x + h y & = 4 \\
3x+6y & = 8.
\end{align*}
\]
</div>
For selected values of $h$, illustrate the solution set graphically.

<span id="ex-systems-homogeneous-t" label="ex:systems-homogeneous-t"></span> (See <a href="../solutions-systems-of-linear-equations/#sol-ex-systems-homogeneous-t" data-reference-type="ref+Label" data-reference="sol--ex:systems-homogeneous-t">Solution 2.14</a>.) For any $t \in {\bf R}$ consider the homogeneous linear system associated to the matrix
<div class="arithmatex" markdown="1">
\[
\left ( \begin{array}{cccc|c} 2 & 0 & 1 & -t & 0 \\ 1 & -2 & 0 & 3 & 0 \\ 4 & -4 & t & 5 & 0 \end{array} \right ).
\]
</div>

<span id="ex-systems-homogeneous-3eqs" label="ex:systems-homogeneous-3eqs"></span> (See <a href="../solutions-systems-of-linear-equations/#sol-ex-systems-homogeneous-3eqs" data-reference-type="ref+Label" data-reference="sol--ex:systems-homogeneous-3eqs">Solution 2.15</a>.) Solve the system
<div class="arithmatex" markdown="1">
\[
\begin{align*}
x_1 - x_3 + 2 x_4 & = 0 \\
x_2 + 2 x_3 - 2 x_4 & = 0 \\
x_1 + x_2 + x_3 &= 0.
\end{align*}
\]
</div>

<span id="ex-systems-1-d" label="ex:systems-1-d"></span> (See <a href="../solutions-systems-of-linear-equations/#sol-ex-systems-1-d" data-reference-type="ref+Label" data-reference="sol--ex:systems-1-d">Solution 2.16</a>.) Consider the linear system (in the unknowns $x_1, x_2, x_3$):
<div class="arithmatex" markdown="1">
\[
\begin{align*}
x_1 + x_2 + x_3 & = 1 \\
x_1 - x_3 & = 0.
\end{align*}
\]
</div>
Is there any $t \in {\bf R}$ such that $(1-t,2+3t,4t)$ is a solution of that system?

<span id="ex-systems-unique-param-t" label="ex:systems-unique-param-t"></span> (See <a href="../solutions-systems-of-linear-equations/#sol-ex-systems-unique-param-t" data-reference-type="ref+Label" data-reference="sol--ex:systems-unique-param-t">Solution 2.17</a>.) Consider the following linear system (in the unknowns $x_1, x_2, x_3$):
<div class="arithmatex" markdown="1">
\[
\begin{align*}
x_1 - x_2 + 3 x_3 & = 0 \\
x_1 - x_2 & = 1.
\end{align*}
\]
</div>
Show that there is exactly one $t \in {\bf R}$ such that the vector $(3+t, 2+t, \frac 23 + t)$ is a solution of that system.

<span id="ex-systems-1-e" label="ex:systems-1-e"></span> (See <a href="../solutions-systems-of-linear-equations/#sol-ex-systems-1-e" data-reference-type="ref+Label" data-reference="sol--ex:systems-1-e">Solution 2.18</a>.) Do there exist $q, t \in {\bf R}$ such that the vector
<div class="arithmatex" markdown="1">
\[
(x_1, x_2, x_3) = (1+t, t+q, -t+2q+1)
\]
</div>
satisfies
<div class="arithmatex" markdown="1">
\[
3x_1 + 2x_2 -x_3 = 5?
\]
</div>

<span id="ex-systems-1-f" label="ex:systems-1-f"></span> (See <a href="../solutions-systems-of-linear-equations/#sol-ex-systems-1-f" data-reference-type="ref+Label" data-reference="sol--ex:systems-1-f">Solution 2.19</a>.) Find a polynomial
<div class="arithmatex" markdown="1">
\[
p(x) = a_0 + a_1x+a_2 x^2 + a_3 x^3
\]
</div>
such that $p(1) = 0$ and $p(2) = 3$. Is there a unique such polynomial?